{
  "schema_version": "scc.map_version.v1",
  "generated_at": "2026-02-08T12:12:13.225Z",
  "valid_until": "2026-02-15T12:12:13.225Z",
  "generator": {
    "name": "scc.map_builder.v1",
    "version": "1.0.0"
  },
  "map_path": "map/map.json",
  "link_report_path": "map/link_report.json",
  "hash": "sha256:edf3211492a9c37d3c3afbfa6a42a594f883819a7083bcbaf6ab1f7486ffc376",
  "facts_hash": "sha256:99752875ef2c083ed0e414c00153bd5e6ff27cafdb99b2927671cfa470ec355e",
  "coverage": {
    "roots": [
      "oc-scc-local",
      "tools/scc",
      "scc-top",
      "contracts",
      "roles",
      "skills",
      "docs"
    ],
    "excluded_globs": [
      "**/.git/**",
      "**/node_modules/**",
      "artifacts/**",
      "**/.scc_secrets/**",
      "**/dist/**",
      "**/build/**",
      "**/coverage/**",
      "**/_tmp/**",
      "**/.opencode/**",
      "**/vendor/**",
      "**/.venv/**",
      "**/__pycache__/**"
    ]
  },
  "stats": {
    "files_indexed": 8734,
    "modules": 45,
    "entry_points": 38,
    "key_symbols": 6000,
    "test_entry_points": 18,
    "configs": 2076,
    "doc_refs": 52
  }
}
